text,subreddit
"How to excel in a physics undergraduate degreeThis post is for advice, I'm starting college next week and this college isn't my dream college, it doesn't have the best physics program, with most of the students just studying there to get a degree and then go for an MBA or something. What would be your advice if you have experienced something similar? I at least want to get a master's degree too. Do you know of anything helpful to distinguish yourself as a serious 'physics person' ? ( I mean self studying some kind of math or studying deeper into a topic or something like that, I have no idea what I'm talking about)",1
"Why do shorter wavelength form better images?I know about Rayleigh criterion and diffraction limit, but can someone explain what is the physical process that is undergoing when an image is formed? And why do shorter wavelengths give better info on position of particle?",1
"How to solve for maximum compression in a spring?Hey y'all, I'm having some trouble here figuring out this problem.
I'm doing introductory calc-based physics right now and this particular problem is in the linear momentum and collisions chapter.

[Here are screenshots and pictures of my work]( but basically the problem involves letter variables instead of numbers, and I have to determine the maximum compression of a spring that is attached to one block that collides into another. I'm allowed to use the variables k, m1, m2, v1, and v2.",1
Practice Exam QuestionI have this question  a practice exam and I'm unsure how to solve it. Can anyone give any advise and of tips and tricks on how to solve this question ? Anything is highly appreciated.,1
"Lagrangian Mechanics and Generalized ForcesSo I'm doing some Lagrange's equation problems and I'm having a bit trouble understanding when generalized forces aren't zero.

Using [this expression]( I'd assume that for a the case of an object free falling, the weight would make the generalized force for the generalized coordinate not zero. Same thing happens with the Atwood machine, why are the generalized forces zero, when the sum of the forces acting on each of the masses (tension and weight) would be non zero?

Edit: for clarification, my confusion stems from [this]( expression.",1
"Does pressure in a sealed container rise as it ascends in altitude?The source of this discussion is talking about inflating an inflatable stand up paddleboard at lower altitude and then driving it up to a mountain lake. These paddle boards have a stiff strong structure that holds their shape. They are designed to hold aprox. 15psi. If someone was to fill the paddleboard to 15psi say at 4,000ft altitude, then drive it to a mountain lake at say 8,000ft altitude, will the pressure in the paddleboard change from the change in altitude or is 15psi in a container, 15psi regardless of ambient pressure?",1
A coin landing both heads and tailsIs there any possible way that flipping a coin could land both heads and tails? Landing perfectly on its edge doesn’t count!,1
"Change in entropy for isobaric and isochoric processesIn my lecturer's notes, it says that the change in entropy for isochoric and isobaric processes are Cv ln (Tf/Ti) + nR ln (Vf/Vi) and Cp ln (Tf/Ti) - nR ln (Pf/Pi) respectively. But shouldn't it be that the second ln terms in both equations are zero as the volume is constant and pressure is constant respectively? I looked up online and all of them show the equations without the second terms.",1
"Measurement accuracy of the speed of lightI'm aware that the speed of light is defined to be 299792458 m/s, and that since 1983 the length of a meter has been defined with reference to that value.

According to Wikipedia,

&gt;After centuries of increasingly precise measurements, in 1975 the speed of light was known to be 299792458 m/s  \[...\] with a measurement uncertainty of 4 parts per billion.

This seems a small amount of uncertainty, but not necessarily so small that an improvement (say to 1 part per trillion) would be practically insignificant.

If measurements of the speed of light were to improve, such that scientists would (in theory) want to add a decimal place to the previous value of c and be confident that this was more accurate, then--unless they were to just ignore this result--according to SI rules the length of a meter would have to change very slightly, in order to preserve the correctness of c = 299792458 m/s.

Google hasn't enlightened me regarding whether, as of 2019, the speed of light has been measured more accurately than it was in 1975, or 1983. Does anyone know whether this is the case, and if so whether the length of a meter has changed since then?",1
Hydrostatics problem,1
"Clarification on pump headOk so I'm trying to size a hypothetical pump to pump out deep ocean water,   and as far as my understanding of pump head is,   if I take a pump.  Attach it to a good pipe and send it 5k meters below.     If it has a pump head of say 30 meters then itll shoot water up at 30 meters above the surface of the ocean provided the pipe is that long and we live in a magical frictionless world.   Right?",1
"Question about Batteries, Wattage and PowerHi Physics friends,

I am currently in the market to buy a new battery to help power some outside things while camping. I'm looking at some batteries that have up to 750 Watt capacity versus ones that have 500 Watt capacity.

My question is that if a battery has a higher Wattage capacity does that mean it will be able to supply power for a longer period of time or just can handle a higher demand for power?

Thank You!",1
"Quantum Teleportation... In just 100 Years? I never found this concept particularly interesting until now. Reading an article from… I think it was The Guardian, I was certainly intrigued at the least. In this article, it said that American physicist, Michio Kaku thinks that problems of waiting for millions and millions of years and hogging the world’s power supply could be solved in just about a hundred years. It says that “he envisages a teleporter that works like and ultra high-res MRI scanner, with accuracy at the single-atom-per-pixel level.” A question from me to people more experienced in this field: Do you personally feel that Kaku is right, considering we have only teleported photons? Do you think that this will be possible in just 100 years and why?",1
"'The persistent illusion of transience'Hi all,

Earlier today I listened to an interesting interview with Alan Moore. He mentioned his belief that all that happens in the universe is predetermined and recurs forever. He said that this accords with Einstein's (source of the above quote) theory of the universe and also made the rather grand claim that 'most modern physicists' agree with him. Is this true? 

My 'field' is philosophy and it struck me how similar this was to Nietszche's eternal recurrence, which was also referenced by Moore in the interview. That may be a useful point of comparison for my understanding of the topic if you have read any Nietszche. 

My knowledge of physics is limited to having watched Cosmos (I am aware that space-time is a thing) and high school physics so I wondered if someone with a bit more authority on the subject could help a brother out. Links to reading much appreciated.

Cheers!

P.S. I am up for discussing the possible impact of such a theory on moral philosophy if anyone is interested in that side of things. It has always struck me that the laws of science seem to be at loggerheads with our understanding of morality. How can we have free will if we know that all matter in the universe acts and interacts in accordance with certain rules?",1
"What are ways of conveying Decibels into more graphable units (e.g. Watts, joules)?So I'm doing an assignment where I have to conduct my own science experiment, and I've chosen to do one that relates to the law of conservation: I drop a golf ball and measure the volume of the impact, in decibels. The independent variable is the height from which I drop the ball. 

I'm already aware that different decibel measurements can't be graphed linearly that easy, since decibels work based on intensity (and stuff relating to how ears perceive sound), but I'm very sure that there's a way to demonstrate a linear trend from my results. 

All my measurements so far include:

* Mass of the ball (having a ball means I don't have to worry about the way it lands when I drop it).

* Distance from the decibel meter.

* Ambient decibel levels (the environment). 

* Heights from which the ball was dropped (of course).

* Resulting decibel levels. 

So while I have lots of numbers written down, I'm not too sure what to do with these. The most legitimate formula I've seen and can use would be:

dB = 10 x log10(w / 10^-12)

Where dB is the decibel level, w is the power of the sound wave (in watts) and 10^-12 is supposed to be the ""reference power"" (something about the atmosphere, also in watts). 

Am I actually on the right track? If not, what are the correct formulas that I use?",1
When do more loops of wire in an electromagnet stop increasing Magnetic field strength due to the increased resistance that goes along with them?,1
"Exercise problem: Lifshitz Classical Theory of Fields. Decay of particles (p.32 ex. 1)Hello there.

Exercise (  been trying to understand this exercise for hours but I just can not come up with a way to get to the first equation. The is no problem. I have already tried to use E^2 - p^2 = m^2 (I just used the convention c=1, which is used in the exercise too.)  and the law of cosine of which I am not even sure if it is applicable in relativistic mechanics. I'd just be glad if somebody could give me at least a good hint (or maybe even a small derivation) how I can arrive at the equation for E_0.",1
"Is the magnetic force weaker when it gets near the center of the magnet?So imagine those classical rectangle magnets, and now we take an object and place it at the magnet's side and move it from North Pole to south pole. Will the magnetic force decrease while the object move from the North Pole to the center of the magnet then increase while it start might toward south pole?",1
"My teacher wants a period formula that in function of the of the height of water inside of a cilinder, tells the physical pendulumthe experiment consists of making a formula in function of height (longitude). we will be filling a cilinder oscillating on the edge of it with water. The period is supposed to change with the variation of height.

(Sorry if the tittle is weird, eng not first language)

This is the formula i've come up so far:

",1
"University Physics by Young &amp; Freedman vs Fundamentals of Physics by Halliday &amp; Resnick (Latest editions)From your experience, which book of those two is more concise and rigorous, in the sense that it doesn't go to great lengths trying to explain the most mundane concepts - but still maintains its formalism in terms of helping establish conceptual understanding of the subject?

I read several reviews of *University Physics* and apparently it has a reputation of giving you ADD halfway through reading due to the ridiculous amount of annotations.

But at the same time *Fundamentals of Physics* seems to be oriented towards Engineering students more than Physics students in terms of the depth and abstraction of its problem sets.

What are your thoughts on those two?

Also if you know another book that provides a better balance between abstraction &amp; rigor without making me sacrifice my mental health (looking at you UP), please feel free to mention it.",1
"Use the counter-clockwise from East conventionA.16.In the Vector Addition Lab, the following data was collected for determining the displacement from the door of the Physics classroom to another location in the building:  2 m West 22.0 mSouth 25.0 mEast 9.0 mNorth 4 mWest. The direction of the resultant displacement is closest to ___ degrees.    (Use the counter-clockwise from East convention.)


The professor say’s the answer is 287 degrees, but I didn’t even get close. Any help to understanding this answer would be appreciated!",1
"Is all energy quantized?I am aware that the energy of a photon emitted from an atom is given by E=hf and that this energy is quantized. Is it always true that energy is quantized? [This]( link from Wikipedia states on Thermal Radiation states: ""The radiation is not monochromatic, i.e., it does not consist of just a single frequency, but comprises a continuous dispersion of photon energies, its characteristic spectrum. Is it true? I always thought that energy in general is quantized.",1
"DC Motor coils questionHi reddit, I have a question about the differences between a single, 2, and 3 coil DC motor that I have to answer in a lab report. In the prac we built a single coil motor and a 4 coil motor, now there is a discussion about their differences. This is the full question. 

""Discuss in detail the motor operation as compared with a single coil motor. Include an explanation of the starting position. What factors could affect the motion of the rotor? With reference to the starting position also explain the differences between the 1 and 2 coil motors compared to a 3 coil motor.""

Keep in mind, this prac is the first exposure we've had to magnetism or motors or any of it. I've done a bit of research on the single coil motors and am fairly sure I understand the motion (familiarised myself with the right hand rule and all that) But I'm not sure what the question means by 'starting position' or the affect that extra coils have on the motion of the rotor (in the prac, it seemed to move exactly the same as the single coil). I hope I've expressed myself clearly, I'm really not sure where to start with this discussion and any online research seems to be very complicated and way above my level of understanding.",1
"KwH?I don’t get it. It’s a unit of...

Energy/time?",1
"Got stumped on an angular acceleration question that didn’t seem familiar, from the one class I missedA:  “A boats propeller makes 300 rev while its speed increases from 200 to 500 rpm, what is it angular acceleration?”

B: “How much time did the increase in speed require?”",1
Can deuterium absorb a neutron to form tritium? If so how common is this in hydrogen bombs and heavy water reactors?,1
"Could physicists fact check this video for me? It's called ""Quantum Mechanics Debunks Materialism""[ video has almost 90,000 views and the comments are overwhelmingly positive. 

&amp;#x200B;

This video claims that: ""Quantum mechanics conclusively debunks materialism and the notion of  there being an objective reality or physicality. These notions have been killed since the 1920s. Reality is not material, not objective, and it  is not a linear rational clockwork machine..."" 

&amp;#x200B;

He also says this about quantum fields:

&gt; QM says that there are no such thing as particles (really). Everything  is fields. A particle is really just a field. It is a cloud of  possibilities. When you look upon this cloud with some instrument or  with your own eyes or with your own consciousness what happens is that a  cloud congeals and collapses into a particular result. These fields are  interesting because mathematically a field is an infinite set of  scalars, so that means you take every single point in space and you put a  number on it that will be a field. \[...\] There’s a branch of science  called QFT says that basically everything is a field and reality is an  interaction of different fields coming together, now, what’s interesting  about fields is its nothing but values but values of what? The answer  is nothing. There is nothing there, a field is infinite nothingness.  

&amp;#x200B;

Also, at around 53 minutes, he uses an elephant as an example, and he says that according to QM: 

&gt;When you're not looking at an elephant, and this is just a metaphor, that elephant exists as every other animal that it could have possibly been. Think about that and really think through the radical consequences of this, it's enormous. When you're not looking at an elephant, that elephant is literally infinite. It's every possible elephant that could ever possibly be that you could ever see or any other creature could see... not only that but it also exists as a kangaroo, as a chipmunk, as a rhinoceros... and then when you look at it it collapses down into that particular elephant that you see. That's a good metaphor for superposition.

&amp;#x200B;

He then says that when you drop your kid off at school, and you don't see them: ""That child exists as infinity, it's nothingness. When you 're not looking at the elephant it's infinity, it's nothingness.""

 

In the video he also replies to the objection that ""observers"" in physics doesn't have to be a conscious human, and that it could also be a laser or a detector, but he replies to this objection by saying that the laser and detectors and computers exist within your consciousness as well. 

&amp;#x200B;

I understand that this may seem out there, but I want to keep an open mind, and if this video is wrong, I want to know which claims specifically are wrong and why. 

&amp;#x200B;

Thank you!",1
"Can you supply your own energy?If you watch black mirror. There is an episode called fifteen million merits. 

These people ride a bike all day to supply their societies energy.

-

-

Would one person generating electricity power enough to sustain themselves?  

Maybe using that power to make light to grow food. 

-

-

I’m thinking you wouldn’t, and most of the energy would be lost to heat.",1
"Any resourceful documents or blogs on Development in the field of optics in ancient and modern India?I've to make a project on this topic but I cannot find enough sources to start with. If you have any knowledge about this topic, please help🙇‍♀️",1
"If a human is exposed to high amounts of ionizing radiation (like in Chernobyl), why is that they remain radioactive themselves?Does the radiation get trapped in their bodies? Wouldn’t it just damage the cells and pass through the body? Or does it get trapped in the body for long periods of time?

Edit: Oh so it’s not that the radiation itself is getting trapped in the body, but that the radioactive material/dust gets stuck in the body which emits radiation?",1
"This might be a stupid question, but I need an answer. Why when light meets an obstacle there is a shadow, but when sound meets an obstacle you can still hear behind that object?",1
"Is it really impossible to travel faster then the speed of light?It appears I'm a bit of an outsider compared to most of the questions. Anyways, I've always wondered why we cant travel faster then the speed of light, and everyone once in a while I will look up the question again. Every time I look it up the answer I get is the same. There is not enough energy in the universe to travel that fast. My question is, Is it actually against the laws of physics to travel faster, Or is it just impracticable and not possible with the resources we have. 

In the case that I'm right and it is not actually against the laws of physics, why is it always stated it is? It seems like something a physicist would not say is impossible, kind of like if you asked them if unicorns are possible, I think they would answer yes, even thought we don't know if they are, because it is not against the rules of physics. Obviously this case is a bit different because it is impossible given everything in the universe, but we don't definitively know whats is beyond what we can see right? It is theoretically possible that there are trillions of more universes such as our own and that their could be FTL travel right? In the case I'm wrong, Could anyone point me towards a good sources as to why we cant go FTL?

&amp;#x200B;

Sorry for the long post.",1
"[Highschool] Question/MCQ regarding simple addition of vectors.[The question]( thought the answer was A but according to the marking scheme, the answer is B. I have no idea how to go about this question. Any help would be appreciated.",1
"QUESTION REGARDING MEASUREMENT AND COLLAPSE OF WAVEFUNCTION IN QUANTUM MECHANICSWe know that the wavefunction is a superposition of many other wavefunctions and when an observation is done, the wavefunction collapses into one of them, my question was if there is a Time Lag between the two events i.e. observing the system and system getting collapsed?",1
"How Kinetic Friction Works When Object Goes Up A RampI am assuming that you already know the equation:

*F = u\*N*

Where *F* is maximum kinetic friction and *u* is coefficient of kinetic friction. Why do we use this equation when something is going up a ramp? I already know some of the opposing is coming from the component of the weight force, but is the kinetic friction always at its max? Isn't it ever the case that *kinetic friction &lt;* *u\*N,* and the rest of the opposing force is provided by gravity?",1
"First course on E&amp;MI recently had my first real E&amp;M course as an undergrad. I found the topic very interesting, so I was dissapointed finding out that the syllabus my professor provided was sloppy and not coherent. What book would you guys recommend for me that covers E&amp;M at an undergrad/semi advanced level that is also a good read?",1
"Struggling to understand work concept. [gr.10 physics]“An astronaut on a distant planet did 308J of work on a toolbox with the mass of 10.0kg while carrying it a vertical distance of 2.2m into his space shuttle. What is the acceleration due to gravity(in m/s) on a planet? 

Only thing i thought to try was the energy potential formula but that turned to a bust real quick. Am i to figure to acceleration or the gravity of the planet, both? I feel like this is really easy to solve and I’m just dumb.",1
"Does the relativistic mass of a particle increase infinitely if the particle's velocity exceeds that of light?Or, alternatively, is the speed of light the point at which a theoretical particle's relativistic mass would become infinite? 

And, does any of this have something to do with how black holes work?",1
"relativityhello

how important is it that I am familiar with topology (differential,algebraic) before I apply to general or special relativity course in uni,?",1
"EM Wave Attenuation &amp; Reflection q's Hi everyone,

As the title suggests, I'm interested in EM wave degradation and reflection. I understand that it depends heavily on the frequency/wavelength, and I'm interested specifically in the 2.4GHz and 5GHz bands (Wi-Fi).

My understanding is that the higher the frequency, the lower the the piercing capabilities of said radio waves. My question is, is there an average value of degradation through common materials like a wall? Or through air? i.e passing through a cinder brick wall, a 2.4GHz will degrade by X%, or 5GHz by Y%, or traveling Xm the radio wave loses Z%.

My next next question is similar to the one above. How significant is reflection in the first two situations? For example, would a wall ever reflect more than it lets pass through?

If it helps, I'm only concerned about small areas &lt; 30m

Thank you for reading!",1
"Can the average kinetic energy in a metal be used to extract electron out of it?So I have been thinking of a way to use the kinetic energy in the metal by heat, to extract electron out, this electron will then move through circuit as electrical energy and re-enter metal with lower kinetic energy, by work. This will cool the metal down while giving electrical current in the current.

&amp;#x200B;

What I know is force of attraction between two electron is

fq = k (q1\* q2) / r\^2

&amp;#x200B;

I don't know how can I convert temperature to kinetic energy of free electron.

But I think Ke is directly proportional to temperature \`T\`

&amp;#x200B;

I am thinking what could be done is we can have a magnetic field through metal such that electrons can create the circle of radius smaller than that of distance between two atoms and a speed parallel to magnetic field enough to escape the electric force generated between the metal and electron, we will be able to convert heat energy directly to electrical energy.

But I don't know if the numbers will add up, and if its possible.",1
"Does the Meissner effect have any aplications?I've just read somewhere that it's the base for the levitation of high speed trains but as it sounded weird, I checked another source that had a much better explanation, so I'm left kinda curious if there's applications for the perfect diamagnetism.",1
"Can someone help me solve this circuit problem?At t = 0 the switch S is closed with the capacitor uncharged. 

The voltage source is 35V, the following resistor is 4 k Ω, and the following capacitor has a capacitance of 143 x 10^-6 F. 

The switch comes after that, and then the voltage source is present again, and the current flows in that direction. 

What is the charge on the capacitor when I = 2 mA? Answer in units of C.",1
"Can someone help me with some REALLY easy questionsHi, I am a computer science major with fear of physics, I am taking a basic course of physics this summer, but I do not understand some basics question and I need help understanding them.So if ayone would help me understand these problems I would really appreciate it (I am studying for a exam that I have on friday) 

[",1
