text,subreddit
"diameter of hole - circular arpetrureLight from a helium-neon laser (*λ*=633nm) passes through a circular aperture and is observed on a screen 4.0 m behind the aperture. The width of the central maximum is 2.5 cm . (Note the width of the central maximum is the distance between the dark fringes on either side of the maximum)

What is the diameter (in mm) of the hole?

&amp;#x200B;

So I've done  angle  = 0.025/4 = 0.0060 rads

&amp;#x200B;

then wavelength / angle =  6.33\*10\^-7 / 6\*10\^-3 = 1.055\*10\^-4  m =&gt; 0.11mm. But the quiz says i've got the answer wrong. what have I done wrong?",1
How to calculate tension force on pendulumOn [this]( pendulum you can see how the net force *F^A* changes with the rotation of pendulum. This results in velocity vector *v* always being perpendicular to the direction towards pendulum's pivot point. Now how do I calculate most importantly the direction of that force at any moment? From high school physics we learned how to calculate magnitude of normal force. And we could extract the direction of normal force from gravitational force by using dot product. The net force would then be *F^net = F^gravity - F^normal*. Now at the ends of the pendulum the force F^A 's direction is predictable. It's like when we calculated net force on sloped planes. But in-between it starts instead pointing inwards in the direction of the pivot point. How do we calculate this?,1
"First year university, nuclear physics questionThis question seems simple but i'm getting it wrong. I'm not using any formulas, should i be? Cheers :) 

 [",1
"Dimensional analysis - converting to pascalsI have no idea how to do this. Tried watching some videos on dimensional analysis but they dealt with other units, and the examples were simpler.  

&gt; The pressure of a column of liquid is given by P = gρh, where g is the acceleration of gravity (9.807ms^-2 ), ρ is the density, and h is the height. The density of mercury is 13.6gcm^-3.  
What is the pressure in Pa exerted by a 760mm column of mercury?",1
"What does a force do on a wire carrying current?Hey all. I don't think this is a homework question because it's not for homework, but I was studying up so Magnetism when I came across a conceptual question. So I understand that Fb=ILB where Fb acting on the wire, I is the current, L is the length of the wire that the force is acting on, and B is the magnitude of the external magnetic field, but what exactly does the force do? I know that the force is perpendicular to the direction of the current because of the right-hand rule. Is the force centripetal like the magnetic force for a charge in an external force? I can't seem to visualize a wire rotating in a magnetic field like a charge would, so I wanted to hear about what a magnetic force would do to a wire.",1
"How does one not fail a physics class?Everyone who has taken this class ends up with C- at the end of the year. I cannot omit this class from my education. Tips? Tricks? Anything can help!

&amp;#x200B;

Edit: This class would probably be considered an AP class. However it is not classified as one, it is a beginning class, but looking at the people that got through it (Including math oriented people), the class is very hard",1
"Is it feasible for the US to demonstrate its military power by using nuclear weapons to write out ""USA"" on the moon in letters large enough to be seen from Earth without binoculars?",1
"How do I analyze this compound circuit?[ everybody. I'm really just asking for help in understanding how this circuit is drawn in the link above. I'm trying to figure out how to calculate the voltage drop and current drop across each resistor, but I've only worked with circuits that were much simpler. 

I'm kind of confused by how resistors 2,3, and 4 (the ones that are stacked together) are set up. I think they are in parallel with each other, but how are they related to resistor 1? I think I should be able to combine the parallel resistors into an equivalent resistor so I can just add up the resistors in series, but I'm confused as to what's in parallel with what and what's in series with what. 

I'm stuck at the stage of figuring out the total resistance, but I think once I figure that out I'll know what to do. Any ideas?",1
Damage by gravitational wavesThe first observation of gravitational waves [sent out 3 solar masses worth of energy]( I imagine we would have a bad day if this happened close by. What would we see? What would it look like? Planets spontaneously turning into plasma? Stars all shifting in the sky like a sky-quake? Would it damage smaller objects like a human body or satellite floating in space?,1
"Intro to Physics - If you're using a vernier caliper(this is for a density lab), and both the main scale and vernier scale line up perfectly, there is no error calculated?Do you expect them to line up perfectly?",1
"I am worried about the piles of grass in my yard combusting, can someone help?So I can’t really figure out the best subreddit to post this on, I figure you all can help me out though. So I was raking up the grass after mowing two nights ago. Got the blue yard waste bin out, and realized it was still full of grass from last year. It became dark out and I went to the bathroom or something and got sidetracked (extreme adhd here) and forgot the job wasn’t finished. Now there are little piles around the yard. I am worried because I remembered I have heard grass piles can spontaneously combust, (like an oily rag can do) and I went up north for the weekend. Idk if it’s worse when the grass is still green because of the oils, or when it dries up because it’s so dry. In Michigan, lower peninsula it is about 60 degrees and overcast, a “rainy day” type of day even though it’s not supposed to rain. So at least the sun is not beating down on it or anything. Tomorrow it is supposed to storm basically all day starting at 9 am. But the weather could be wrong (esp for Michigan), should I worry about it if it gets sunny? If it did catch on fire, it wouldn’t really spread because the piles are just in the yard and not next to anything in a ten foot radius. You never know with fires though if you can’t babysit them.",1
Electric potential of long wire with linear charge density Q(z)I'm working on an assignment that's similar to [this](  and in (7) there is a formula for potential around a non-uniformly charged wire with a boundary condition \\phi(r = b) = 0. What's the derivation for the formula?,1
"Intuitive way of thinking about graphene's linear dispersion relation? (Not a HW question)Hi everyone,

I'm a first year physics PHD student, and in my QM class I had a problem where I had to show that graphene has a linear dispersion relation close to the Dirac Points, where the positive energy bands and negative energy bands touch. This linear dispersion is analogous to the linear dispersion that massless particles have. So, I was wondering is there a deep connection here? Or is this just a coincidence?",1
"Can you explain shear stress to meHow can a tangential force do anything to an object if it isn't in contact with the surface/plane? 

I get it if two objects are in contact, obj 1 on top of obj 2, obj 1 experiences a force rightward, and the friction causes a tangential force to obj 2, which causes it to deform because obj2 is held to the ground. 

What exactly is shear stress? I already watched a couple of videos but they dont address how the force causes deformation if it ain't touching the object. In my understanding, a force only does something if it has a component that is acting on the object. A tangential force is 0 degrees and shouldn't do anything???",1
"Exam Question on Gas Laws relating to Volume/PressureIn a recent exam a question I was asked “Using the kinetic model of a gas, describe what would happen to the pressure of the gas if its volume were increased”

Now I was a bit confused about the wording of the question as it sounded like it suggested that the volume increased because of the increase in pressure but then again I answered differently.

My answer:

• As volume is increased the particles have a greater distance between them
• So collide with each other and the walls of the container less often
• Less frequent collisions mean less average force is exerted on the container walls, since P=F/a pressure decreases

Is this correct?",1
"What's the difference between mass and energy?Yea simple question really. Why does mass occur, and why do we treat it any differently than energy?",1
"Please help me understand event horizonsHi!

I have never studied astronomy, all I know is pieced together from articles. Maybe you can help me with these questions about black holes.

#####My understanding
1. According to an outside observer, objects falling into a black hole asymptotically approach the event horizon. 

2. Black holes lose mass due to Hawking radiation and eventually evaporate.

#####Questions
1. Although objects become red shifted and invisible, they never cross the event horizon. Is the horizon covered in a lumpy shell of infalling material, frozen in place?

2. Would this shell have a solid surface?

3. As the mass of the black hole increases, would the growing radius of the event horizon cause these objects to pass the horizon?

4. When the black hole eventually evaporate, would the objects (except maybe the ones that fell through due to 3) be free to reach the observer?",1
"Working out potential difference in circuit?If R1 is set to 0 ohms, then what is the PD accross R3? I really don't know how to figure this one out. To me, total current on the left hand side is 10/30 (0.3333) Total current on right hand side 2/10 (0.2). Combined to get 0.533333, use this with total resistance (10+30) to get 21.33V but that isn't correct. Any ideas?

 [",1
"Twin paradoxTwin paradox: two twins, 1 stays at Earth and the other travels away in a spaceship and comes back. I know how the twin paradox is resolved because one twin accelerates when he comes back, breaking the symmetry of the problem. Still something's not really clear to me.   

When one twin travels away from the other in a spaceship close to the speed of light, they both see each other's time being slowed down. Fine. At some point the twin's spaceship turns direction and goes back to Earth and when he arrives the other twin will be older. Fine. But at some point the Earth twin must've aged faster, and it can't be when the spaceship is not accelerating. **So does that mean that during the acceleration of the spaceship, the Earth twin suddenly aged very rapidly (in the eyes of the spaceship twin)?**",1
Do we know the precise velocity in which the CMB is uniform (not redshifted in any direction)? Can this be used as a universal way of denoting a standard velocity?,1
"What is the failure of superposition principle in quantum mechanics?In a book it says that  ""we know of quantum phenomena in the electromagnetic field that represents a failure of superposition,seen from the viewpoint of the classical theory.""

I want to about what quantum phenomenon he is talking about.

This was from the page 11 of the book Electricity And Magnetism by Edward M.Purcell and David J.Morin (3rd edition)",1
Does law of conservation of quantum information explains why quantum entanglement occurs?,1
"What is the reading on the Voltmeter?I've tried using Kirchoff's laws (summing Voltages around the loops) but it seems to lead to contradictions. How do I work this out?

  negligible internal resistance)",1
"Behaviour of a stochastic process when reversing time.An atom has undergone radioactive decay, if we were to reverse time to the moment prior to this event is the atom 100% guaranteed to decay or is the process still stochastic and dictated by randomness?",1
"Quick truss question[The question.]( 

I know for a fact that A(y)=0, but I can't figure it out why. Can someone explain the logic behind it, please",1
"Probably a really stupid question, but if quarks and antiquarks destroy each other, wouldn't the proton/neutron cease to have any quarks at all then?I'm doing a research task on quarks and I'm kind of struggling to understand that if the quarks are constantly destroyed, wouldn't the proton for example no longer have quarks and as a result also lose their charge?",1
"A question on simulating quantum computing and its relation to real world simulations.I am having difficulty describing what I want to say when it comes to quantum computing, so please bare with me if I make mistakes in my phrasing.

From everything that I have read on quantum computing and how it works, it seems that the inherent advantage of using quantum computing is that we get ""free"" computation in the form of probabilities when we read various states of the qbits and their relations to other qbits.  That is to say it is easier to do quantum computation then it is to do simulated quantum computation.  So while there are websites out there where you can do simulated quantum computation all the way up to 22 Qbits, its seems that it would be impossible to do simulated quantum computation on lets say 256 Qbits.   Where as it seems we would be able to do quantum computation with 256 Qbits if we get the machinery in place, etc....   With that in mind, it seems impossible to perform a 100% accurate simulation of any part of a universe where you have to deal with even only 256 Qbits.  Am I wrong in my assumption?  Like, how can we even come close to performing an accurate simulation of even the simplest molecular interactions if we are unable to simulate all of the underlying processes, such as quantum interactions, etc....",1
"Would our observation of an event speed up if we headed straight towards it, close to the speed of light?I'm imagining a space ship with a crew who were heading towards something observable in the universe, a dying sun for example. 

They foolishly decide to head straight towards it at a speed above what is currently feasible. Say also that's its millions of light years away so the event has 'already happened' and we're witnessing the light catching up.

As they head towards it would the event appear to speed up as they closed the gap between the light and the sun itself?",1
"Do curved levers still work? see attached image.

Ex A is straight forward,  the 10 lbs with a 5 foot arm will lift the 8 lbs with a 5 foot arm

In Ex B my question is will the 10 lbs with 5 foot arm lift the 8 lbs with the 5 foot arm that's curved at a 45 degree angle into the 2 foot arm (7 feet total)? 

Or rather is the way it works, getting the total distance from the fulcrum to the end of the arm which would probably be more like 6 feet rather than 7 feet.

I haven't been able to find info on curved or bent levers and how that will affect the mechanical advantage. 

So in ex B will the curved arm holding the 8 lbs be able to lift the 10 lbs with 5 foot arm? Thanks",1
"[Error Propagation] Error Bars and Dividing Quantities Without UncertaintiesNot specifically a physics question but rather one that is related to all sciences.

Screenshot of Question: [ 

Description of Question: A magnetized needle is oscillating on a strong about a vertical axis in a horizontal magnetic field B. The time for 10 oscillations is recorded for different values of B. \[Diagram\] \[Graph\] (in screenshot). **Write down the time taken for one oscillation when B=0.005T with its absolute uncertainty.**

Attempt: Time taken for 10 oscillations is 8.4 ± 0.21s, so time taken for 1 oscillation is 0.84 ± 0.21, as the dividing quantity does not have an uncertainty, how ever the answer says it is **0.84 ± 0.03 s, accept uncertainty 0.03 or 0.025**. 

My two issues with this answer.

1. Apparently they divided the uncertainty by 10 as well, i thought if you were dividing a quantity without an uncertainty you do not need to touch the uncertainty
2. No way in hell is the error bar ±3s or ±2.5s 

What am i doing wrong?",1
"Could inertia also be connected to extra dimensions?So I have absolutely no training in physics but I do love the subject.  I love critically thinking about physics and the nature of reality. 
(Unfortunately table top physics isnt a thing anymore)

But I had a intriguing question and never had a professional to ask.

I wonder if inertia could be connected to extra dimensions and the motion of energy and mass (because E=mc2) through those extra dimensions. 
I was thinking about this because I know that space and time are sometimes considered to be a interwoven fabric of reality, but that you can effect one or the other by changing your acceleration. 

I am wondering if inertia could be thought of the same way as time and space.  
Can the resistence of mass be due to it already having a nonzero motion through unseen spaces? And when we apply a motion through space and time it subtracts from the nonzero motion through another dimensional space? Giving us the resistance we observe?",1
"Rotation of a Point Particlehey,

I wonder if there is a meaning of rotation for a point particle. Does a point particle have angular momentum and does he reply to torque?   
and does a point particle can rotate around another point particle and have those properties?  
thank you!",1
"What are the effects of assumptions and interpretation on understanding quantum mechanics?I often wonder how much of the strangeness of quantum mechanics results from the underlying assumptions in developing quantum mechanics as well as how the results of quantum mechanics are interpreted.  

For example, how does quantum mechanics treat particles and space, and what sort of assumptions do we have to make in order to formalize our treatment of particles and space?  Does interpretation of something like the uncertainly principal require impose additional assumptions?

Most articles and books written for the lay person proceed as if particles are 0-dimensional points, space is built up as a continuous division of points, and the uncertainty principal imposes limits on what we can know through measurement.  In doing so, we are assuming space is a continuous object, there are particles in space that occupy a single point, and once measured, a particle has a well defined location even if we cannot entirely know that location.  

However, I think that if one changes the background assumptions, the understanding of what happens above changes.  (I don't think these are great examples nor do I believe them - they're just easy to think about and thus a useful starting point.)  If we still assume space is continuous but particles had some size and shape which is able to move in a non-uniform manner (different parts moving in different speeds or directions), our inability to measure its position could be related to how we try and collapse this into a single positional value.  Or, what if particles are just bigger than what we would expect and in doing a measurement, we are only seeing a given piece a particle?",1
"Calculating force that keeps rigid object from strechingIf I have a ~~rigid~~ solid object in a vacuum with endpoints P1 and P2. That is constrained at point P1. If a force *F^PUSH* is exerted at point P2, we can calculate the magnitude and direction of the net force *F^NET* from *F^PUSH* and *F^NORMAL* and the angle α between the two.

Here is a quick sketch  after applying the force  *F^NET*, the object's end point P2 is going to gain velocity *v*. If there're no other forces applied the point is going to move infinitely further away from point P1. What is the force called that prevents that, i.e. the force that keeps the objects from stretching. And how do we calculate it? Is Hooke's law applicable here?",1
"Why do physicists say time is emergent property?How can time be an emergent property of something else?  If something else creates time what causes it to create it?  Aren't we giving up causality when we even talk like this?

I started thinking about this since I watched a YouTube video on Loop Quantum Gravity.

How do physicists justify this kind of claim?",1
Does anyone know of any good resources for understanding Lie algebra in the context of QM. I didn’t take 3rd year maths for a reason and it’s too much.,1
"Mathematics in physics/astronomyI'm currently a (pure) math student set to graduate next year with plans of earning an MS in Math or Statistics. I initially thought I wanted to major in physics/astronomy and pursue a career in research, but gradually became more interested in math. I switched majors because it seemed the wiser choice for employment/salary after school.  I was worried about opportunity after I'm finished with school because my impression is that there isn't much to go around. I didn't want to be caught unemployed and hurting for money in pursuit of astronomy research. I'm so torn because I want to do both and I feel like I'm at a fork in the road.

My questions are if an aspiring mathematician can have a role in physics/astronomy? If I'm unsatisfied with my career after school, is it possible to get into that kind of research without having to pay for another degree? Am I making a smart choice by (hopefully) securing a decent income instead of risking failure trying for an exciting research position?",1
"Do billiard balls really rebound from each other at 90-degree angles?I've been playing Snooker Live Pro on Facebook recently.  Like all pool-type games I've seen, this game shows the expected paths of both the target ball and the cue ball.  I noticed that in this game, the two paths are always 90 degrees apart.  Is that how it works in real life?  I think it's safe to assume the two balls are rigid, and ignore any effects of spin.

And another question I've been curious about:  If the cue ball and the cushion were both rigid, when a cue ball bounces from a cushion, the angle of incidence would equal the angle of reflection.  But, of course, the cushion is not rigid.  Is the angle of reflection greater than or less than the angle of incidence?  Again, ignore spin.",1
"How do we mine Helium?Friends and I are talking about how at some point we're going to run out of helium (and how we just use the stuff to fill balloons). Then we started wondering exactly *how* we mine and/or source helium. We're studying for finals right now and don't really have the time to research it, but a cursory google search didn't reveal much. Can anyone provide some insight? Also, is there any reason to worry about the potential of running out of helium?",1
My mind has gone dead for a silly little conversion in an assignment and cannot remember this for the life of me and cannot seem to find it. How do I convert 0.249 kN/mm2 to MPa? I feel stupid for asking.,1
"does anyone know how to solve for problems that ask for a function?which relationship could express the net force of an object with constant mass as the function of the object’s acceleration?
1. y= k•x
2.y=k•x^2
3.y=k/x",1
"White light in: single slit, young's double slit and diffraction gratingI'm just wondering how best to understand how white light behaves in single slit, double slit and a diffraction grating experiments.

&amp;#x200B;

This is apparently the image for Young's double slit: [ know that by w = lambda\*D/s, as red light has a larger wavelength the fringe spacing will be greater, meaning the fringes themselves are wider. If you look at the central fringe, where all wavelengths have interfered constructively, why is it tinged with a kind of murky red? Is this because the red fringe is larger? If so, then, it is clear that the next colour (moving outwards from the centre) is blue, then white, then red. I'm confused how this works with regard to the wavelengths...

&amp;#x200B;

For a diffraction grating, again I understand that directly opposite the beam (source of light), there is constructive interference so you get a thin white line. However, you get spectra of all the colours after dark gaps. In these dark gaps, is all the light arriving out of phase with each other? If so, how do you get the dominant colours forming the spectrum in between the dark gaps?",1
"Rotating an object by applying forceHello,

I have a question about how to use ""thrusters"" to rotate a landing module. For simplicity, it is all in 2D, the red arrows are the direction of the thrusters when they fire and it is upright, yellow is the rotation axis.

I have an inital rotation of the ship thetha, and I want to figure out how much thrust I have to apply on what thruster to rotate it back so the rotation of it is correct again (aka. no rotation). All thrusters always fire orthogonal to the surface they are mounted to.

What I know is (i) the mass of the object, (ii) distance from the thrusters to the axis, and (iii) how much force each thruster can apply in Newtons.

&amp;#x200B;

I wonder how I can go from those pieces of information to a change in angular velocity? Or in other words, how I know how many degrees/radians I have turned if I have fired a thruster for *n* seconds with a force of *f* Newtons.

&amp;#x200B;

To solve this problem, I have looked at the formula for torque which seems to be ""T=F\*r\*sin(theta)"". F is the force, r the distance from the axis, and theta is the angle at which the force is applied. In my example, if I would move up the thrusters slightly, this should always be pi/2 because the thrust vector is orthogonal to the surface, so I can simplify to ""T=F\*r"". If I say that I apply 300N and the thruster is 2m away, I apply 600\[Nm\] of force but know I am stuck, and I have no idea how to calculate the change in angle if I apply this force for n seconds.

&amp;#x200B;

[A small drawning to illustrate what I mean.]( Thank you for your time. :)",1
[Newtons second law] Calculate the acceleration of a systemI've wrote and sketched the question right here: [,1
