text,subreddit
"What was wrong with my thought process? (I dont need you to explain me the math, just the logic) 

I dont need you to explain me how to solve the following question, because I I already know that I can use the X - Xo = Vot + (at\^2)/2 formula to solve it; my problem is that I dont know why I can't use a=ΔV/Δt instead. So, to the question:

&amp;#x200B;

&amp;#x200B;

""An object moving with uniform acceleration has a velocity of 12.0 cm/s in the positive x direction when its x coordinate is 3.00 cm. If its x coordinate 2.00 s later is 5.00 cm, what is its acceleration?""

&amp;#x200B;

The thing is, my thought process was: if the acceleration is equal to ΔV/Δt, then I need to find the second velocity (the first is given, which is 12cm/s). So, I tried to find the second velocity by doing V=ΔS/Δt, which is = 5-3/2-0, which ended up being 2/2, which was equal to 1cm/s. Once I found that, I tried to find the acceleration by doing a=ΔV/Δt. The first acceleration is 12m/s and the last was 1m/s, and the time was 2 seconds. So I did a= 1-12/2-0, therefore a= -5,5m/s\^2.

&amp;#x200B;

The answer, however, is -11m/s\^2.

&amp;#x200B;

So what was wrong in my thought process? Is it because if a is constant, then I must assume that it is not equal to ΔV/Δt ? If so, why is that? If not that, Is it because a=ΔV/Δt means only average acceleration and I must assume that if a is constant, then it must be instantaneous acceleration? If so, why? (Lol, sorry for the bunch of questions.).

&amp;#x200B;

Also, can I, instead of giving that answer, just maintain what I did, and just change it at the end, putting a= 1-12 = -11cm/s\^2 instead of a= 1-12/2-0? If so, is it because Im supposed to ignore the time somehow or what? And if thats the case, why is that?

&amp;#x200B;

 

That's all... Thank you for your time.",1
"How to Solve this deceptively confusing UAM Problem?When you’re just given initial height and total time of a projectile, how do you solve the max height of an object. I’ve tried to use the UAM equations, but am stuck because you can’t find initial velocity the initial velocity with just those two. It seems like it should be simple, but I can’t figure it out.",1
"CurivelocityHi. First post, be gentle with me. This is a question about speed/velocity and space/time. Now, as I understand it, speed can only be measured relative to something else. So, suppose we have a spaceship traveling at .9c relative to Earth. Some sort of science fictional gateway opens up and precipitates it into an alternative reality, then closes back without a trace. I'm assuming space/time exists here or the ship itself couldn't continue to exist. But that's all. This cosmos contains no matter, no energy, no mass. The ship is the only thing that exists here. My question is this: under these circumstances, does the ship still have any speed? Does it have velocity? If the answer is no, then does time still appear to 'pass' on her? As an addendum, does the answer change depending on whether the ship is manned or robotic?",1
"What's wrong with my derivation of distance?This is embarrassingly simple but I don't understand where I'm going wrong.

&amp;#x200B;

distance traveled = (avg velocity) (time)

&amp;#x200B;

avg v = (1/2) (starting v + final v)

&amp;#x200B;

so distance = (1/2) (starting v + final v) (time)

&amp;#x200B;

= \[(1/2) (starting v) (time)\] + \[(1/2) (final v) (time)\]

&amp;#x200B;

Assume constant acceleration, so final v = (a) (t)

&amp;#x200B;

distance = (1/2) (starting v) (t)\] + \[(1/2) (a) (t\^2)\]

&amp;#x200B;

But obviously this isn't right. The first (1/2) isn't in the final derivation. Where have I gone wrong?",1
"Something I'm having trouble withIron Ball: Ti = 1300 C           Water: Ti = 20 C

m = 4.2 kg                        m=10 L

C = 450 J/kg C                 

&amp;#x200B;

The Iron ball is dropped in 10 L of water at 20 C. 0.5 L of water is rapidly turned into steam (at 100 °C) and lost from the experiment. The ball and remaining water come into thermal equilibrium. What is the final temperature of the water? 

I got 49.37 C but the answer is 53.125

&amp;#x200B;

Also;  

What is the change in entropy of the water, associated with the half a litre of boiling water turning into steam (at 100°C)?  idk what to do with this one altogether.

&amp;#x200B;

Any help is appreciated, thanks.",1
is constructive interference only possible with periodic waves ?,1
"Speed vs Velocity   I am going through Physics by Giancoli and I have run into an example that I am struggling to comprehend. The exact question is ""How far can a cyclist travel in 2.5 h along a straight road if her average velocity is 18 km/h?"" The approach provided to the question is to find the distance traveled. It does not ask for displacement. But can't you only solve for displacement using velocity? To find the distance traveled you would have to know the speed of the cyclist which is not given. 
   I think at the end of this, the wording of the question is probably supposed to mean that the cyclist is moving in one direction for all 2.5 hours. And thus the speed and the velocity have the same magnitude. But the question could have definitely been worded better.",1
Why do nerf darts fly further when fired at an angle compared to a flat shot?Its a bit of a weird question but its for a report comparing different angles. So what theory or whatever is the reason why they fly further when shot at a angle?,1
"Need Help with sound/waves lab question - Thereotical resonant frequency. Gr 11 Physics.Question is ""Calculate the theoretical resonant frequency for each tube using the standing wave formulas.

You will need the air temperature for this to calculate the speed of sound."" 

&amp;#x200B;

I can't find the Formula(s) needed to solve this via google or my notes.

If anyone knows how to solve this can you please tell me how?

Don't need an answer, just steps to solve. :)

Thanks!",1
"Which one is (in your opinion) the most fundamental discipline of physics?I've seen there was this big debate back in 1900 about whether it was mechanics or thermodynamics and that somehow gave born to the concept of the stat mech ensambles.

Now I know this is not an objective question so I was just wondering what are some opinions out there.",1
"ELI5: Bell's TheoremI am working on a project in a basic high school physics class, and I have very basic knowledge of quantum physics. Can someone give a basic description of what this is?",1
"Microscopic Reversability QuestionThe laws of physics are the same for both directions of time, but since entropy increases we have an arrow of time on the macroscopic scale. 

But, the microscopic scale doesn't follow this arrow of time, so it is reversible. Anything that happens on the micro scale can happen in reverse. So why doesn't it happen, or does it happen all the time? If so, what are some examples?",1
What phases of matter are there?And what is the field that studies them?,1
"Difference between the (Strong) Equivalence Principle and the General Principle of Relativity.I’ve been trying to teach myself some General Relativity (the only time I saw it in university was in a catch-all field theory course) and I’ve been wondering about these two principles:

Strong Equivalence Principle (SEP): local test physics is not affected by the presence of a gravitational field.

General Principle of Relativity (GPR): the fundamental laws of physics are the same in all frames of reference.

I’m having a bit of a hard time understanding the distinction between the two. My current interpretation of the matter is:

SEP is saying that you can “pretend” your frame of reference is subject to fictitious forces (thinking in classical terms) arising from the fact that it is non-inertial (hence the need for locality, because fictitious acceleration would be constant throughout space).

GPR is saying that you can explain all fictitious forces as gravitational fields, which seems to be an equivalent statement to the previous.

Can anyone shed some light on the topic? Are they the same? Is there something I’m missing?",1
"Destructive vs Constructive Interference QuestionQ: What is the thinnest film (but not zero) that produces a strong reflection for green light with a wavelength of 500 nm ?

To solve this, I used 2t= (m\*lambda)/(n) and let m= 1. I got 200 nm which was the right answer, I just don't get why I'd be using the formula for destructive interference. In lecture, my prof went over a similar problem and used the formula for constructive interference because he noted that the light was visible. The textbook also mentioned that light near green 500nm would interfere constructively. Can someone please explain why you would need to use destructive interference for this problem?

&amp;#x200B;

Update: the other info given for the problem above was that ""A very thin oil film (*n*=1.25) floats on water (*n*=1.33).""",1
"So in the next 7 hours, I have to decide whether I’m taking Matrix Theory or Discrete Math over the summer. I am desperately looking for some guidance, and would greatly appreciate any input from you guys.Honestly, it would probably be better to take the easier class. Is discrete math easier? Is it *much* easier, or just a little easier?

I was also told matrix theory would be more applicable to my physics classes. I’ll be taking quantum and mechanics in the Fall. My emphasis is astronomy. To be really frank, I’m not sure how much I care about what I’m studying anymore, and I won’t be going to grad school (at least not right after I graduate next May).

Any answers to those questions would be hugely appreciated. Any other input is also welcome. Thanks guys.

Edit: Feel like maybe I should add that this will be my last math class. Just taking physics stuff in the fall and astro electives in the spring.",1
Fluids:If the pressure is the same in every direction then why is there more pressure at the bottom of a body of fluid?This is kind of confusing for me. Does it have to with the fact that it's more about the pressure being the same at any point at a specific height?,1
"probably really basic but not for meI am looking to model a seesaw where the weight of the beam is the variable.

I want to find how much the beam would have to weigh for for a persons jump height to double if they are alone on one end of the beam.

the beam should be 7 meters long and balanced the person should weigh 70kg and be able to put 600 foot pounds of energy into the jump (this is my guess as a leg press max should be double your weight and the travel is about 2 feet).

I am way out of my depth and would appreciate even a direction to look in, but honestly I have been out of school 20+ years and doubt any of it will stick at this point. I don't even know how to model the jump without the beam to see if my force is in the ballpark of human (40-50cm jump)

*[context]( bad sketch](",1
"Is Lagrangian/Hamiltonian mechanics actually worth studying outside of more advanced Newtonian dynamics?I.e. is the L/H formalism actually worth studying if one has already taken more advanced Newtonian dynamics such as that used by mechanical engineers? I get the gist of the formalism, and the principal of least action, although it seems ridiculous that this is held as a fundamental principal when the inclusion of friction dismantles the entire formalism. How can this even be held as a fundamental principal when including a ubiquitous example of a basic tenant of thermodynamics leads to its breakdown? The physics is all really just still F = ma, no?

Anyway, having said these things (L o l) is it worth doing so?",1
"Why is the volume of a Bravais lattice primitive cell given by the vector triple product?Every online resource I've found just states it as fact that given the primitive vectors a1, a2, a3; the volume of the cell V=a1.(a2 x a3)

I have an example question as part of my revision for an exam that asks why this is the correct formula but conveniently the solutions skip over it.

(Apologies for the formatting)",1
"Ultrasound physics, attenuation coefficientHello, just a small question.

A pulse of frequency *f* (MHz) is emitted into a material with attenuation coefficient *a* (dB/cm/MHz). If the pulse travels a distance *d* (cm) then I have to find the loss.

The answer finds it simply by saying that loss = *a\*f\*d* (dB).

Sure the units work out, but shouldn't we use the equations for loss and intensity? Equations :

*loss* (dB) *= 10\*Log(I / I\_0)* where *I / I\_0 =  exp(-μ\*d)*

I presumed that *μ* (dB/cm) = *a* (dB/cm/MHz) *\* f* (MHz) because the exponential must have units of dB

So my answer would be *loss = 10\*Log(e)\*(-μ\*d)* (dB).

Why is using the actual equation for signal loss wrong?",1
"Tension question from ""Thinking Physics"" by EpsteinWhen the strongman suspends the 10-lb telephone book with the rope held vertically the tension in each strand of rope is 5 lbs. If the strongman could suspend the bookfrom the strands pulled horizontally as shown, the tension in each strand would be

a) about 5 lbs b) about 10 lbs c) about 20 lbs d) more than a million lbs 

I don't have any physics training or classes. I've been trying to learn some of the basics of physics with the book ""Thinking Physics"" by Epstein and this question is really confusing me. The illustration just shows the man pulling the two ends of the string apart into a horizontal position. 

The answer is D more than a million lbs. Can someone please explain why? Preferably not with formulas I wouldn't understand. I feel confident I can do this with a 20lbs fishing line and it wouldn't snap so how is it holding more than a million lbs tension? 

Thanks",1
"Tension Problem Difficulty 

Hey everyone,

Right now, I am working on a Physics problem I was hoping to get some help on. Here it is:

[ here is what I have worked out:

[ is the part after number ""2"" on the left hand side. So, I basically have drawn the FBDs, but am pretty confused on where to go from there (I'm not even sure if my fbds are correct). Any advice would be fantastic!

Thanks",1
Is the speed of light a constant in all environments or is it relative to the gravitational influence?,1
"Centre of mass of the human bodyI don't understand how to solve this question. I know that Force = mass * acceleration but don't understand centre of mass. :/  
&amp;nbsp; 

&gt; Fence height = 6m  
&amp;nbsp;
Your height = 1.8m  
&amp;nbsp;
Your mass = 75kg  
&amp;nbsp;

&gt; To get down on the other side of the fence, you risk life and limb and jump (from the top of the fence). As you land you bend your knees to absorb the impact, crouching to 60% of your full height.  
&amp;nbsp;
 
&gt; 3. What is the average impact force that you have sustained in you landing considering that your centre of mass in now lower than if you were standing straight? We can assume that your centre of mass is located in the exact centre of our body.",1
"Help with these questionsI would appreciate it if anyone could help and solve (while showing the steps) these problems. Thanks for the help! 

1. A solid cylinder has a mass of M and radius R.  If it rolls without slipping on a horizontal surface with a linear speed of v, how high will it roll up an incline of angle θ?  Don’t worry about friction. The moment of inertia for a cylinder is (1/2)MR2.  Express the vertical height in terms of the given variables M, R, v, θ and g (some might not be used).



2. The base of a record player is a disk that has a mass of 2 kg and a diameter of 34 cm.  A child spins it so it rotates at a constant rate of 50 times a minute. Neglect friction and anything that complicates the problem. Then, the child drops on a record (also a disk) with mass 1.3 kg and a diameter of 32 cm. How many times a minute will they spin together if the record player base and the record stick together (assume there is no slipping when the record lands on the base)?  Remember, for a solid disk or cylinder, I = ½ MR2.

3. What is the minimum height you would have to place a solid ball of mass M and radius R (I = 2MR2 / 5) on a hill in order for the ball to make it completely around a circular loop at the bottom of the hill?  The diameter of the loop is D. Assume the ball rolls without slipping.

Edit: I have what I have done below so I have made an effort",1
"Does anyone know of research into higher dimensional space travelI stubbled across these papers a while back
 others and was wondering if anyone knew of research actually being done in traveling in more than 3 spacial dimensions.  I'm aware that the validity of these theories tenuous at best but a boy can dream.",1
"I can't solve pendulums using Newtonian mechanicsImagine a pendulum with its support attached to a horizontal or vertical spring. Solving it is really easy using Lagrangian formalism, but I don't know how to solve such systems using Newtoninan mechanics. Could anyone point me on the right direction?

Force components would be:

Fn=T- mg cos{theta}

Ft=-mg sin{theta}

But then I'm really lost. Is T related to the spring's force?",1
"Could someone explain Special relativity for a dumb dumb like me?More specifically time dilation and length contraction I’m finding it difficult to grasp the situation to which these sort of things can happen. I don’t understand proper time and moving relative to the things that’s traveling near the speed of light, I understand frames of reference. Thanks",1
"What coolant could be used in space for nuclear reactors?I'm not a scientist, nor a science student - I'm game developer working or sci-fi space game and I was wondering if I could use ammonia for cooling of steam from Boiling Water Reactor, based on Fukushima Daiichi design.

I'm asking if it's possible to use ammonia instead of traditional water (from cooling tower) because it is used on International Space Station as main coolant due to its very effective cooling properties. On ISS they're cooling ammonia by thermal radiators. I'm little bit confused if ammonia would be acceptable as coolant for reactor because of its quite low boiling point.

I will welcome your opinions on this. Of course it is just a sci-fi game, but I would like to have it based on some real science. Or would you recommend some different coolant instead maybe?

(I like ammonia also because it is compound of nitrogen and hydrogen which I'm already using in the game as resources.)",1
"Tension Problem DifficultyHey everyone,

Currently, I am working on a tension problem. Here it is below:

[ is my work so far. I've essentially redrawn it all, added the proper weights, and attempted free body diagrams.

[ not sure where to go from here or even if my FBDs are correct. I know I have to get the sum of forces somehow, but the pully is throwing me off and so is the first question asking for the tension between m1 and m2. Any advice and clarity to this would be amazing!

Thanks",1
"Learning advanced physicsI have recently become interested in physics and lots of the different theories surrounding it. Currently, I am 14 years old so I have time to learn them. I was thinking, as I would like to go in to theoretical physics, should I learn lots of the theories now or wait for university. For example, relatively and string theory. I believe I have the ability to do so but I don't want to rush now and regret it later. Also, which ways would be the best to learn them if I should do so now and which theories should I learn? Thx.",1
"Could someone draw a basic spacetime diagram that depicts how a spacelike interval allows for backward time travel?Or because it's nonphysical, is this just not something that spacetime diagrams are actually able to depict? I'm confused.",1
"Is an object that takes up a finite space but infinite area possible?Ok I know by the title this sounds dumb but I recently read heard about the Koch snowflake, a shape with a finite area but an infinite perimeter.

Imagine a 3D object similar to a Koch snowflake. Just a sphere, but if you zoom into the surface, you can keep zooming for an infinite amount of time and it just keeps going. This had me confused, because it takes up a finite space, yet you can zoom into it infinitely. So, is it really infinite, and would something like this be possible?",1
"What happens other than movement?On an atomic scale, what other kinds of things besides movement can ""happen""?",1
"Seeking Information about Physics MajorHi everyone, I have decided to look into changing my major to physics.

I will be a junior this fall, but I decided to change my major to chemistry this past semester (from a non-science major) as I developed an interest in understanding more about how the world works. I took calculus I and general chemistry I, and am currently taking general chemistry II as a summer class.

I find chemistry fascinating and enjoy understanding how matter interacts and changes form. Yet, I noticed that I am more drawn to the areas of chemistry that share more in common with physics, such as electrochemistry, nuclear chemistry, and thermodynamics. I like that physics encompasses more than the scope of chemistry, including topics like mechanics, optics, and electricity and magnetism. I also enjoy the fundamentals of physics concepts and how they explain natural phenomenon. I like mathematics and would enjoy the challenge of applying calculus to solve physics problems.

I am considering either a degree in chemistry, with a physical chemistry concentration, or a degree in physics. (I would graduate a year later than originally intended if I chose to change to physics.) I know there is a lot of overlap between the two, and I have not decided which path I am more interested in pursuing. Would it be reasonable to graduate with a chemistry degree and pursue graduate studies in physics? I currently have an interest in working in the areas of renewable energy and materials science after graduation.

I appreciate any advice or resources that can help me make a decision.",1
"Coefficient of friction databaseCan anyone help me find a good source for coefficients of friction? I've been trying to just Google it, but I can't seem to get a table with the interactions I want. I'm making a program to simulate the friction and collision interactions of various materials. The ones I have selected are: wood, metal, rubber, and ice. However, I have been unable to find the data for scenarios like, ice sliding on wood or rubber sliding on steel. Can anyone help?

Edit: Based on the article in the reply, let's swap out ice for glass.",1
"Can I get some help understanding spacetime and velocity as relating to the 2nd law of thermodynamics?So as I understand it (at least in the Minkowski model), we are always moving at the speed of light through spacetime. If you increase your velocity through space, you decrease your velocity through time. Because of this, if you move 2 clocks through space, one significantly faster than the other, then when you bring them back together, it turns out that the clock that moved faster is a little behind the other. Motion relativity effects between objects moving significantly slower than the speed of light, then, are pretty much just another layer of relativity on top of this. In addition, the speed of light is a universal speed limit. But, theoretically, if you COULD move faster than light, you'd be reversing causality or going backward in time in some way, or something along those lines. These are my assumptions coming in to this.

Anyway, this brings me to my questions.

First, if it's impossible for an ""object"" (you know, like, something that's not a wave/particle with a velocity of c) to actually achieve the speed of light in space, does that mean the same object also can not fully stop moving? There's probably a temptation here to respond by saying ""stop moving relative to what?"" So to clarify, I mean stop moving in the sense that your velocity ""on the space axis"" in the Minkowski model is zero. The reason I ask is that if it's impossible to achieve zero on the time axis and c on the space axis, shouldn't it also be impossible to achieve zero on the space axis and c on the time axis? And if it IS possible to stop moving on the space axis, why is that? (given that you can't stop moving on the time axis)

Then the second question is this: Whenever I ask the internet, ""why does time only move forward"" or ""why do objects all move the same direction through time"" or some variation on that question, the answer always seems to be ""because the 2nd law of thermodynamics dictates that the universe must move from a more ordered state to a state of more entropy, therefore you can't unmix a cup of coffee and milk."" But this seems to me to be a truism, or in other words, an answer that doesn't do anything more than describe the question in a different way. It just begs the new question, why does everything move from order to chaos? If we go back to the Minkowski model, it would seem that in a universe moving toward a state of total entropy, all objects would simply be reducing their velocity on the space axis and increasing their velocity on the time axis. So I find myself unable to conceptualize any actual relationship between entropy and time at all. Is there actually a relationship there I don't understand? Or can somebody explain why everything seems to move forward in time without using the 2nd law of thermodynamics as an answer?",1
"How can I make an Accurate Projectile Launcher that can Hit a marble 2 meters farther than it using springs?I'm using a spring launcher, and I want to know what the restoring force should be, and how far should I compress it to make it hit 2 meters?",1
