text,subreddit
Hi guys ! What's the best YouTube series/learning websites for optics ?,1
"Is Nitrogen in a higher layer of the atmosphere or do we have 78% of Nitrogen and 21% of Oxygen in the air we breathe?I was told that the blue color of the sky is due to the presence of higher quantities of Nitrogen (78%) than Oxygen in our atmosphere but does that mean we breathe more Nitrogen than Oxygen ? Or is the Nitrogen on a higher layer than Oxygen like when you mix Oil and Water and it creates two layers.
Thank you",1
"How is planck length defined without reference to planck time?I looked up planck length on wikipedia and it says it's the distance that light travels in one planck time, but then I looked up planck time and it says it's the amount of time it takes light to travel one planck length...

So this is obviously circular and unhelpful without further information. What do these units actually capture?",1
"Speed of a Sphere (involving Moment of Inertia)Hey everyone  
I have a question here about a problem involving a sphere and its movement onto a ramp. Here it is below:  
 [ 

Here is how I worked the problem out:

 [ 

So, the answer I got was wrong. It is supposed to be .25m/s. But after working and rechecking my worked out solution, I do not know where I am going wrong with this. I'm thinking the answer is wrong, but if someone could take a look at my work and see if I did something wrong, that'd be fantastic!  
Thanks!",1
"Material similar to skin in terms of layered structure?Hi! I am new so I'm not sure if this question fits here, but since this is sort of like material science I thought I'd try

&amp;#x200B;

I have problems with dermatillomania, which is basically just chronic (and sometimes painful) skin picking. I was wondering if there is any material similar to skin that I could pick on. It would have to have several thin layers, and those layers should not come apart too easily. I have tried letting glue dry on my skin, but it irritates my skin and also comes off too quickly for me to be properly occupied.",1
"Cart-Pully Physics ProblemHi everyone,  
I am currently working through some physics problems and right now I am stuck on the following one:  
 [   
I am honestly pretty confused as to where to start with this. Can anyone give any pointers as to where I could possibly go, for (a) and (b)?  
Thanks!",1
"energy levels with bohrwhy is n1 lowest energy level? Shouldnt it be highest? The attraction between the proton nucleus and the electron gets stronger the closer they are. So why is n1 lowest energy, and n3 higher electron energy. In other words, I want to understand the why behind the bohr model and rydberg. Likewise, why does the rydberg formula have a negative? As stated by my previous logic, the closer the electron is to the nucleus, the stronger the attraction. Thus shouldn't the energy be a higher number, and thus more positive?",1
"Where can I read an introduction about dark energy?There's a chapter in my intro to astronomy course about dark energy. It's about how we know about its existence (CMB anisotropy, something about inflation and flatness, etc) but it's poorly explained imo. Is there a good place where I can read about it?",1
"Mass on Wedge Problem.[ above link contains image of the question and all details. It is from Kleppner- Classical Mechanics 2.11.

Clue at the back of the book: If A =3g then acceleration along y = g  
I have tried:

1. considering acceleration along x = A then solved from ground frame (non-inertial). The answers do not match.
2. considering acceleration along x = A +a . This gives two unknowns and one equation. Cannot solve further.
3. Using pseudo force concept. Taking acceleration along  to be both 0 and a (with gives same equations as 1. and 2. respectively)

Please help!",1
"Critique of this psychology article trying to apply stat mech to attitudes enough I was talking to a physics professor a couple months ago about applying stat mech to human research, like modeling a person. I also brought up hopfield networks which someone showed me a while ago as an example of a nice attempt which doesn’t play out all that great. 

In conclusion, we talked about how stat mech isn’t really built for it and you also have the problem of defining what really is your macro and what really is your micro (ie what about all the stuff below and above and in between). 

I don’t have a strong background in physics so I was hoping to further this discussion now that I came across the article and would be curious if anyone else had some interesting thoughts and examples.",1
"Ideal Angle for Drying a Cylinder?Hi there.

I just rinsed a beer bottle and put it on my drying rack for recycling. It got me wondering if there's a best angle to place something like that for maximum drying efficiency.

Straight up is obviously wrong as gravity would counteract the effects of evaporation, but straight down seems like it would lose the benefits of having water gather together and be more prone to exit the bottle.

So assuming a perfect cylinder under normal gravitational and atmospheric conditions, is there an ideal angle to place a bottle so that it would have maximum drying efficiency?",1
"Pretty quick question if this formula existsSo in a test I have randomly made up the following formula:
m = A • rho • s
That’s mass [kg] = frontal surface area [m^2]• density [kg • m^/3] • distance [m]

If you look at units, it checks out. Did I just get lucky about this, or is this a real formula? My teacher says I made it up, which I basically did, but I really need the point haha.

I don’t think context matters, but if you  want it I can provide it. Thanks!",1
"I have a 300 000km wire coil made of room temperature superconductor.The speed of light is +- 300 000km/s and I've created a long strand of superconducting wire.  

I have a battery bank of whatever required capacity.

I connect the terminals of the battery to either end of my wire for 9/10ths of a second.

I disconnect the battery.

I short both ends of the superconductor together.  (in the remaining 1/10ths of a second)

&amp;#x200B;

What on earth have I made?",1
"Electric field lines and electric fieldfrom vector calculus we know that derivative of a vector is a vector pointing tangentially to steepest increase,electric field lines are always tangent to electric force. Does this mean that electric lines are derivative of a force with respect to something? from what I learn electric field is simply dF/dq.",1
"Spinning motor problemI have a motor that  is connected to a wheel of radius r attached to a chain. The chain goes from the first wheel to a wheel of radius = 2r. The angular speed are equals (I think) but the force (or is a momentum?) Used in the first wheel is different from the ""output"" force of the second wheel. How can I find out how much different they are?
Thanks in advance and I hope to have been clear",1
"Math help problemI’m having trouble solving this puzzle. I know this isn’t really physics related, but I was hoping you could help me out on this one anyways. Apparently the answer is 1/3

",1
Why does going back in the time and changing the last doesn't change the present,1
"Isotopes&amp;#x200B;

So I've been given this table.

&amp;#x200B;

[ this question:

""Does this value correspond exactly to a given isotope or does it suggest there may be a mixture of isotopes? If so what other ones might be present and why are they hard to detect with this experiment""

&amp;#x200B;

So basically the this experiment was using a geiger-muller counter to identify the isotope of a copper sample we'd been given. I found the sample had a half life of 6.79 minutes, so then I looked on the above table to find the coressponding value or similar value and found the closest to be 5.12 minutes which is the Cu-66 isotope.

&amp;#x200B;

Right, so it doesn't correspond exactly to a given isotope, but I'm not sure what it means by 'there may be a mixture of isotopes'?",1
"Is the moon's orbital velocity around earth faster than a satellite at that altitude?Since the equation for orbital velocity takes into account the mass of both bodies, and since the total mass between earth and the moon would be higher than earth and any satellite, I would assume that the moon's velocity would be faster, and therefor it would eventually catch up to and crash into anything you put in the same orbit, right?  


I suppose if this were the case, this would explain how one planet can clear out an entire orbit around a star, including asteroids that are on the opposite side of the orbit.",1
"finding mass of americiumSo I have values for A = 3.64\*10\^10 , lambda ( decay constant) = 5.08\*10\^-11 and I have the N value = 7.16\*10\^20

&amp;#x200B;

but I'm unsure where to go from here to find the mass.. any tips? Is there an equation? Our book has also mentioned Avogadro's number = 6.022\*10\^23 but I don't know where that fits in to find the mass.

&amp;#x200B;

&amp;#x200B;

question and info we've been given:

[",1
"Potential of Concentric Spherical Insulator and ConductorHey everyone,   


[ I'm stuck conceptually on this problem. I have to find the electric potential at various points in this picture (Sphere). The inner circle is uniformly charged, where the outer ring is a uncharged conducting shell.   


I was first asked to find V(b), which is the inner surface of the conductor. This turned out to be V(b)=kQ/c. Is this because the charge on the inner surface is equal to the outer surface?   


The second question asked me for the electric potential on the inner surface of the sphere. I thought this would be V(a)=kQ/a + KQ/c, but that was incorrect. The correct answer was kQ/a +kQ/b - kQ/c. I have no idea how to derive this myself.   


I cannot find any good resources on this. Would anyone be able to help me conceptually?",1
Is it possible that the doppler effect of radiation is one of the causes of dark energy?,1
What does energy integrated over time mean? Is this even a useful measurement to have?,1
"I want to learn the following topics in no particular order special relativity, general relativity the wave function in quantum mechanics, Heisenberg uncertainty principle and quantum entanglement. How do I go about doing this?Also what makes something quantum? I heard that it is the very small which makes me think it has something to do with mass but then again a buckyball behaves quantum mechanically.


My problem is I only have a grade 12 education. My math knowledge is pretty weak and I never took physics. Any good online resources I could use. I would prefer a few free online classes. Also it would be useful if the class had questions that I could practice. I find if you just learn the material and never test your knowledge it hard to tell how much you understood",1
"Was the universe basically just an infinitely large black hole ""before"" the big bang?So, as far as I know, before the big bang, all of the matter in the universe was densely packed into a singularity, and then every particle started getting away of each other.

My question is, we all know what happen when we pack a large amount of matter very densely, it create a black hole right? So what is the difference between the original singularity and a ""regular"" black hole? 

Is the universe just an incredibly massive black hole that ""exploded""?",1
"Momentum question ball a collides with stationary ball b of equal mass, ball a is 2.5g and hits ball b at .4m/s.

Ball a deflects at an angle of 30 degrees when collided 

What is the speed of both balls?

I know how to solve this knowing one of the resulting velocities. How should I approach this question?",1
"Adding air resistance to the parabolic equation of a projectileThis sub should rly consider allowing pictures.

Y=tan@*x -( 9.81/(2*v^2 *cos^2 (@))) *x^2

Ok so @ is theta because why not. This is the equation of the parabola of a projectile. I have a project why I have to see how the distance varies with the coefficient of drag. Does anyone know how to substitute/add an equation of drag in this?

I've tried simulators online but I need the equations as well. Thanks a lot",1
"where can I find everything that Isaac Newton did?He's got my curiosity now, I have been seeing him in my books for 3 years now. 10th (Motion), 11th (Gravity, Binomial Theorem, Optics etc) and now 12th (law of cooling, Newton rings etc). I want to know what else he did. Would love to read it this summer, even if I don't understand.",1
"Need help on a corrective lens question  A farsighted student wears contact lenses with a prescription of +2.50 Diopters. This allows her fully accommodated eye to focus on her physics exam sitting 25.0 cm in front of her eyes. Assume that the eye lens-to-retina distance of this student's eye is 2.00 cm, and the contact lens sits a negligible distance in front of the eye lens. What is the focal length of this student's fully accommodated eye? 

&amp;#x200B;

I know that you have to use 1/f = 1/object distance + 1/image distance.  I think 25 cm is object distance and I know that I will have to convert to meters so that it is consistent with the diopters which is 1/ focal length in meters.  Do i regard the eye lens to retina distance as image distance?",1
"thermodynamicsi’m having a problem understanding the concept of internal energy of a gas how come it is only affected by temperature change and also equals W+Q   
imagine it's an adiabatic process will the internal energy be affected   
please if there is a youtube video or a site that fully explain this provide the link 

  
this is the problem that confused me   
When an ideal gas in a cylinder is compressed at constant

temperature by a piston, the pressure of the gas increases.

Consider the following three statements.

I. The rate at which the molecules collide with the piston

increases.

II. The average speed of the molecules increases.

III. The internal energy of the gas increases.

Which statement (s) correctly explain the increase in pressure?

A. I only

B. II only

C. I and II only

D. I and III only",1
Just making sure I understand torque correctlySo torque is the amount of force needed to move an object a certain distance across its center of mass?,1
"Is the past implicitly encoded in the present?My understanding is that it is impossible to exactly predict the future of the universe based on the present state of the universe and physics theory because of the Heisenberg Uncertainty Principle (and maybe n-body gravitation problem and stuff like that). Is it also impossible to exactly determine the past based on the present state of the universe and physics theory, or is the past implicitly (and exactly) encoded in the present (so at least in theory the universe ""has a memory"")?
Edit: (bits in parenthesis) Heisenberg",1
"Bycicle Hoop and Moment of Inertia ProblemHey everyone,

Right now, I am working on a bicylce hoop problem that I'm having a bit of trouble on. Here it is:

[ here is how I worked it out:

[ some reason, I did not get the right answer, and I am not sure why. The work looks fine to me, but maybe I am going about it wrong. The right answer is **47.4J**.

Any guidance would be excellent. Thank you!",1
"Why don't you get shocked if you touch a wire?I'm reading about shocks and how you can only receive one if one part of your body has a different electric potential than another. So you would receive a shock if you were touching one low electric potential wire and another one with a higher electric potential. My question is if you touched a wire with a different electric potential than your body, wouldn't one part of your body be a different electric potential than the one that was holding onto a wire? and thus you would receive a shock? Or does your body not even have electric potential?",1
"Is it Possible to Boil Part of a Body of Water?If a pot of water is large enough, and you concentrated flames in one area, is it possible to boil the water in the vicinity of that flame rather than the entire pot?",1
"Buoyancy Problem HelpHere is what I am given: 

A rectangular boat is said to float in water of density 1000kg/m\^3 and it takes up a volume of 0.66m\^3. What is the total mass that this boat can be in order to remain in a state of equilibrium? 

&amp;#x200B;

I figured that I should probably use Archimedes principle and set it equal to weight, this way I can solve for mass; yet the number that I get doesn't seem right. Here is the equation that I used with numbers plugged in:

&amp;#x200B;

pV=m (since the 'g' cancels out)

(1000kg/m\^3)(0.66m\^3) = m

660kg = m

&amp;#x200B;

660 kg seems like far too much of a mass. Did I do something wrong or is that just the way it is?

Thanks for the help!",1
"Why does an object with a larger 'run up' of acceleration carry it's momentum further?Why does an object with a larger 'run up' of acceleration carry it's momentum further than an object that has the same amount of speed at release/launch, but with a shorter run-up?  


Or does it? I'm thinking of the way the length of a gun barrel effects the bullets distance, despite the 'explosive force' being the same energy, speed etc.",1
Why is stopping power energy dependent?,1
"Vertical waveHello everyone. I would like some help on the question b of the following exercise. Here's the context:

An encyclical sinusoidal wave is created on a string by the oscillating edge of a rod with amplitude A=0,005m. The frequency of the motion is 120Hz. The linear density of the string is 120 g/m and it is stretched by tension Τ=90N.

First we are asked to find the maximum value of the vertical velocity which is Vy,max= 3,77 m/s . Next we are asked to find the maximum vertical tension. What I did was the following:Since we are assuming in these problems that the angle θ of the string relative to the horizontal level while oscillating is small(it makes our life easier), we have the following equation: Τy= T\*sinθ = Τ\*tanθ = T\* dy/dx = Τ\*(dy/dt)\*(dt/dx)= Τ\*(Uy/Uδ) where Uδ is the wave propagation velocity. It seems though that my result is wrong.",1
"What's the average electricity bill for an office building?On the below website, it says that ""the average individual office building uses 1.4 billion Btu a year.""

[ I live in New York where the price of electricity is $0.18/kwh, how can I calculate how much an office building pays for electricity yearly? This is not homework, more for a personal project. Thanks!",1
"Parallel CircuitsI can't find any precise information on this but say you have two 40 ohm resistors and put them on two wires running on a parallel circuit (one on each). If both of them are running, the total resistance in the circuit would be 20 ohms. Would this change back to 40 ohms if you flipped one of them off? It just seems kind of weird to me that you would calculate the current in each wire and then add them up once they reconnected and went back to the battery.",1
"A question about gravity If space-time is infinite ,how gravity extends to infinity?  
 we know infinity is unreachable because it continues forever and no-one reach a finite point.How gravity extends to infinite distances while  infinity is unreachable? how gravity bends and curve space-time everywhere while space time end is unreachable? for gravity to bend space-time everywhere it should reach its end , how gravity bends space-time end while this end is unreachable? 

Does force between two masses placed anywhere in space exists ?  
it means for force to exist gravity should be everywhere as well .  
Space-time curvature happens due to mass existence , is mass existence effect ""curvature""  everywhere ?   
how this effect could reach infinity"" infinity is not an end or point but something continues forever"" while infinity is unreachable? 

 A mass started to bend the space-time around it at time, is it physical that this curvature happens at the same time everywhere?",1
"Is dark energy another arrow of time?I recently asked a question about time and whether it is real or emergent. The general view, from what I gathered, is that there is no preferred direction of time, the arrow of time is emergent due to entropy. But, is dark energy and the expansion of the universe also an arrow of time as space always expands with time?",1
What is that symbol called that looks like an upside down 9 and flipped horizontally called(I've seen it used in physics)?,1
"Force of pump to bucket question illustrated in the image there is a 1 meter tall bucket with 20 gallons of water inside. At the bottom of the bucket there is a tube measuring 15.2 cm in length and 25 mm in diameter. Attached to that tube is a small hand  pump or syringe(15.25cm w x 25.4 cm L)with 1 gallon of water inside it.

My question is how much force in newton's would I have to apply to pump in order to empty the 1 gallon into the 20 gallon bucket?

Also would the difference in length of tube make a significant difference if it was about 1 meter long and at the surface of the water?
Or will the increased length of tube create more force output on the pump than if it was short and at the bottom of the bucket? 

Thank you for your time",1
"Does current move on the surface of a wire or through the wire?I just learned that when excess electrons are added to a conducting material, they reside on the surface of the material. Does this mean that current moves on the surface of a wire rather than through it? This doesn't make sense to me especially because the resistance of a wire depends on its cross sectional area, not its surface area.",1
"I don't understand what are the virial coefficients B2, B3, etc...Like, I know how to calculate them, I know they represent the corrections due to interactions between particles, but what does it mean B2 is bigger or smaller?",1
"Electrostatics questionFigures: [ balls are in an electric field as shown in Fig. 1. Balls A and B are touching eachother, ball D is nonconductive.

1. Which balls will be electrically charged?
2. Ball A is taken out of the electric field and hung using a nonconductive string (Fig. 2).   
Explain what will happen when each of the other 3 balls will be in proximity to ball A.  
Will ball A be repelled, drawn or stay in place.

&amp;#x200B;

For question 1 I answered that only ball A and B will be electrically charged (A with negative charge; B with positive charge). Balls C and D will remain neutral.

Question 2 is pretty straightforward as well. Ball B is positively charged and therefore ball A will be drawn to it. Although ball C is neutral, ball A will induce a postive charge to be in proximity to it and will be drawn to it as well. 

My only question is about ball D. Is the fact that it is nonconductive matters to the issue of induction. Or in other words - are nonconductive materials subject to the process of inducing a charge (like with ball C) ?

I would very much appreciate any comments. Thanks!",1
"The unit of stopping power is Joules*(cm^2)/(10^15)atoms. Can someone tell how to interpret this unit physically?By definition, stopping power is the energy lost by an energetic beam/particle in travelling a unit distance. How does then cm\^2 and 10\^15 atoms come into picture?",1
"Maximum stress withstood by a grid fin during reentryHello Reddit. I'm currently doing a paper on the materials that can be used to make grid fins but first I have to find what are the stresses that they will have to withstand. I've been searching for a couple of days but I haven't found anything certain. I have tried framing it as a load and sheer force problem but I haven't got any experience in that so I've found it difficult to calculate anything. The data that I have collected is the following:

* The maximum acceleration that the craft experiences is 5.6 g.
* The dimensions of the fin are 1.22 (Width) by 1.524 (Length) by 0.22 (Height) meters.
* The total mass of the rocket (Falcon Heavy centerstage) is 424.6 tonnes, however, the burned fuel changes this to around 30 tonnes.
* At this point, the aerodynamic pressure is of 2.6 kN/m\^2
* The mass of the fin is 100 kg (Not totally sure).
* The diameter of the stage is 3.7 meters (This makes the total cross section cutting right through the fins 3.7+1.524\*2=6.748)

Feel free to make any simplifications that you want, I only need a rough estimate of the stresses that the craft withstand. But I have only gotten values of either 2 or so MPa (Too low to be true, since the aluminum fins suffered a lot and they have around 400 MPa of tensile strength) or 5000 MPa (The titanium fins currently in use wouldn't withstand this load).

Thank you in advance.",1
"Question regarding photoelectric effectThis is a question I recently had on my exam, and I’m curious as to why I get h=6.6* 10^-34 when it’s supposed to be 6.42*10^-31 according to my teacher. 

Question:

Light of 430nm wavelength shines on metal plate. The necessary voltage to stop the escaping electrons is .79V. 
If the wavelength is put at 400nm, 1V is needed to stop the electrons. 

a) What value of Plancks Konstant(h) does these measurements give? 

b) What value for the wavelength threshold(f0) does these measurements result in?

I used the 4 given values to create a equations system where I could calculate f0, based on the equation E=Eu + Ek(h*f = h*f0 + ((mv^2)/(2)).   

I then used that to calculate h. 

If you have any questions on how I did it or whatever feel free to leave a comment, thanks in advance!",1
